id,title,score,num_comments,author,created_utc,url,over_18,edited,spoiler,stickied,upvote_ratio,locked,removal_reason,report_reasons,removed_by,mod_reason_by
1b6gtls,Germany's Scholz speaks out against Assange extradition,23,0,DoremusJessup,2024-03-04 17:32:21,https://www.dw.com/en/germanys-scholz-speaks-out-against-julian-assange-extradition/a-68433675,False,False,False,False,0.65,False,Not Available,Not Available,Not Available,Not Available
1b6szeh,Former Canadian Embassy worker wins battle for Japanese employment benefits,24,0,Gyro_Armadillo,2024-03-05 01:47:41,https://english.kyodonews.net/news/2024/03/a325fca3e1a1-former-embassy-worker-wins-battle-for-japanese-employment-benefits.html,False,False,False,False,0.77,False,Not Available,Not Available,Not Available,Not Available
1b6jvsr,First Undersecretary of the Ministry of Electricity: The solar plant is a strategic project with a capacity of 120 megawatts,23,0,martareyes995,2024-03-04 19:33:39,https://www.sada-alsahel.net/news/135696,False,False,False,False,0.75,False,Not Available,Not Available,Not Available,Not Available
1b6kia0,"AWS plans to launch Saudi Arabian cloud region in 2026, promises $5.3bn investment",23,5,brooklynlad,2024-03-04 19:59:22,https://www.datacenterdynamics.com/en/news/aws-plans-to-launch-saudi-arabian-cloud-region-in-2026-promises-53bn-investment/,False,False,False,False,0.73,False,Not Available,Not Available,Not Available,Not Available
1b70rqg,Lords pass five amendments to Rwanda bill in heavy defeat for Rishi Sunak | Rwanda,22,0,MadDivision,2024-03-05 08:55:20,https://www.theguardian.com/world/2024/mar/04/lords-pass-five-amendments-to-rwanda-bill-in-heavy-defeat-for-rishi-sunak,False,False,False,False,0.74,False,Not Available,Not Available,Not Available,Not Available
1b6skww,China premier to skip parliament press event for 1st time since 1993,22,1,Saltedline,2024-03-05 01:29:23,https://english.kyodonews.net/news/2024/03/20c809a3cc1f-china-premier-to-skip-parliament-press-event-for-1st-time-since-1993.html,False,False,False,False,0.73,False,Not Available,Not Available,Not Available,Not Available
1b6rgff,Retirement and re-employment ages for Singapore to be raised to 64 and 69 in 2026,21,3,ccamnvqs,2024-03-05 00:39:09,https://www.channelnewsasia.com/singapore/retirement-reemployment-age-increase-4168776,False,False,False,False,0.76,False,Not Available,Not Available,Not Available,Not Available
1b76j2q,India to build new naval base on Lakshadweep archipelago to boost security,18,0,Budget_Put1517,2024-03-05 14:29:59,https://www.reuters.com/world/india/india-build-new-naval-base-lakshadweep-archipelago-boost-security-2024-03-02/,False,False,False,False,0.77,False,Not Available,Not Available,Not Available,Not Available
1b78i7f,"Recent developments point to Iran strengthening its ties with Al-Burhan and the Sudanese army, leading to speculation about the establishment of a new Iranian system in Sudan.",25,0,EvansJCastillo,2024-03-05 15:51:31,https://sudantribune.com/article282831/,False,False,False,False,0.96,False,Not Available,Not Available,Not Available,Not Available
1b78bjb,"The growing relationship between Iran and Sudan, particularly with the Sudanese army, raises concerns about Iran's expanding influence in Africa.",22,3,martareyes995,2024-03-05 15:44:21,https://english.aawsat.com/world/4891051-reports-about-iran%E2%80%99s-bid-naval-base-sudan-sparks-controversy,False,False,False,False,0.87,False,Not Available,Not Available,Not Available,Not Available
1b77edm,Taiwan issues 'sincere apology' over minister's racist comments against Indian migrant workers,21,6,Budget_Put1517,2024-03-05 15:06:45,https://thewire.in/world/taiwan-apologises-after-labour-minister-sparks-row-about-skin-colour-of-indians,False,False,False,False,0.77,False,Not Available,Not Available,Not Available,Not Available
1b73dy9,Iran LPG Exports Rise to Record Despite US Sanctions,21,3,EuphoricWarning2032,2024-03-05 11:50:45,https://www.bloomberg.com/news/articles/2024-03-04/iran-lpg-exports-rise-to-record-despite-us-sanctions,False,False,False,False,0.78,False,Not Available,Not Available,Not Available,Not Available
1b6t533,‘10 pockets’: South Korea’s low birthrate fuels ironic boom in baby care sector,20,0,Gyro_Armadillo,2024-03-05 01:54:43,https://www.scmp.com/news/asia/east-asia/article/3254014/south-koreas-baby-care-sector-sees-ironic-boom-families-show-their-love-splurging,False,False,False,False,0.72,False,Not Available,Not Available,Not Available,Not Available
1b79puu,"Despite UN warnings, Iran’s execution of Kurds and political dissidents continues unchecked",34,1,drak0bsidian,2024-03-05 16:38:08,https://theconversation.com/despite-un-warnings-irans-execution-of-kurds-and-political-dissidents-continues-unchecked-223138,False,False,False,False,0.95,False,Not Available,Not Available,Not Available,Not Available
1b6hejh,Singapore tightens rules for hiring foreign professionals,15,2,Gyro_Armadillo,2024-03-04 17:54:56,https://globalnation.inquirer.net/226895/singapore-tightens-rules-for-hiring-foreign-professionals,False,False,False,False,0.69,False,Not Available,Not Available,Not Available,Not Available
1b771b5,Ghana’s president delays decision on controversial anti-gay bill,17,1,semafornews,2024-03-05 14:51:58,https://www.semafor.com/article/03/05/2024/ghana-president-delays-decision-anti-gay-bill?utm_campaign=semaforreddit,False,False,False,False,0.84,False,Not Available,Not Available,Not Available,Not Available
1b6ycg4,Trouble in Bangkok as Filipino transgender group clashes with Thai peers,13,2,Gyro_Armadillo,2024-03-05 06:14:04,https://globalnation.inquirer.net/226932/trouble-in-bangkok-as-filipino-transgender-group-clashes-with-thai-peers,False,False,False,False,0.66,False,Not Available,Not Available,Not Available,Not Available
1b74mqo,EU to release funds for Palestinian aid organization UNRWA – DW,7,19,cheesemaster_3000,2024-03-05 13:00:19,https://www.dw.com/en/eu-to-release-funds-for-palestinian-aid-organization-unrwa/a-68423061,False,False,False,False,0.55,False,Not Available,Not Available,Not Available,Not Available
1b794my,Hungary opposes Mark Rutte’s bid to run NATO,11,7,BostonSubwaySlut,2024-03-05 16:15:09,https://www.politico.eu/article/hungary-opposes-mark-ruttes-bid-to-run-nato/,False,False,False,False,0.72,False,Not Available,Not Available,Not Available,Not Available
1b78atz,Birmingham City Council to vote on cuts after effective bankruptcy,9,2,citytiger,2024-03-05 15:43:34,https://www.bbc.com/news/uk-68476173,False,False,False,False,0.74,False,Not Available,Not Available,Not Available,Not Available
1b78v01, China-Maldives defense deal signed amid India rift ,8,0,one_brown_jedi,2024-03-05 16:05:01,https://www.dw.com/en/maldives-signs-defense-deal-with-china-amid-rift-with-india/a-68440100,False,False,False,False,0.78,False,Not Available,Not Available,Not Available,Not Available
