id,title,score,num_comments,author,created_utc,url,over_18,edited,spoiler,stickied,upvote_ratio,locked,removal_reason,report_reasons,removed_by,mod_reason_by
1b6iopa,Hamas official: 'We don't know which of the hostages are dead or alive' - report,17569,2320,capitaldefacto,2024-03-04 18:45:30,https://m.jpost.com/breaking-news/article-790201,False,False,False,False,0.85,False,Not Available,Not Available,Not Available,Not Available
1b6tezx,China drops 'peaceful reunification' reference to Taiwan; raises defence spending by 7.2%,13296,1441,monkfreedom,2024-03-05 02:07:04,https://www.reuters.com/world/china/china-drops-peaceful-reunification-reference-taiwan-raises-defence-spending-by-2024-03-05/,False,False,False,False,0.94,False,Not Available,Not Available,Not Available,Not Available
1b735me,France's Macron urges Ukraine's allies not to be 'cowards',8511,743,pierrepaul,2024-03-05 11:36:08,https://www.lemonde.fr/en/international/article/2024/03/05/macron-urges-ukraine-s-allies-not-to-be-cowardly_6587199_4.html,False,False,False,False,0.94,False,Not Available,Not Available,Not Available,Not Available
1b6hh9z,"British soldiers ‘on the ground’ in Ukraine, says German military leak",6949,640,SecondAccount404,2024-03-04 17:57:59,https://www.theguardian.com/uk-news/2024/mar/04/british-soldiers-on-ground-ukraine-german-military-leak,False,False,False,False,0.94,False,Not Available,Not Available,Not Available,Not Available
1b6u0sj,IDF releases recordings of UNRWA teachers taking part in Oct. 7 massacres,6931,726,god_im_bored,2024-03-05 02:35:09,https://www.jns.org/idf-releases-recordings-of-unrwa-teachers-taking-part-in-oct-7-massacres/,False,False,False,False,0.84,False,Not Available,Not Available,Not Available,Not Available
1b6i2u1,"London Mayor Wants to Sell Homes of 'Putin Cronies' to Fund Building of 4,000 Low-Cost Homes",6564,190,reeseinthecity,2024-03-04 18:21:35,https://www.ibtimes.co.uk/london-mayor-wants-sell-homes-putin-cronies-fund-building-4000-low-cost-homes-1723796,False,False,False,False,0.97,False,Not Available,Not Available,Not Available,Not Available
1b6jpha,UN envoy says 'reasonable grounds' to believe Hamas committed sexual violence on Oct. 7,6158,847,ExactlySorta,2024-03-04 19:26:35,https://apnews.com/article/israel-palestinians-un-rape-oct7-hamas-gaza-fe1a35767a63666fe4dc1c97e397177e,False,False,False,False,0.88,False,Not Available,Not Available,Not Available,Not Available
1b6gsak,"British warship and U.S. aircraft seize 6,000 pounds of cocaine and other drugs after ""high-speed chase"" in Caribbean Sea",3583,209,trueslicky,2024-03-04 17:30:55,https://www.cbsnews.com/news/british-warship-us-aircraft-seize-cocaine-drugs-high-speed-chase-caribbean-sea/,False,False,False,False,0.97,False,Not Available,Not Available,Not Available,Not Available
1b6kj71,Three Red Sea underwater data cables have been cut as Houthi attacks continue in the vital waterway,2966,155,EsperaDeus,2024-03-04 20:00:20,https://www.yahoo.com/news/three-underwater-data-cables-red-143239992.html,False,False,False,False,0.98,False,Not Available,Not Available,Not Available,Not Available
1b6h88w,IDF accuses additional UNRWA officials of Oct. 7 massacre,2699,292,yoyo456,2024-03-04 17:48:03,https://www.jpost.com/israel-hamas-war/article-790191?utm_source=jpost.app.android&utm_medium=share,False,False,False,False,0.87,False,Not Available,Not Available,Not Available,Not Available
1b6kkby,Putin ally says 'Ukraine is Russia' and historical territory needs to 'come home',2442,403,EsperaDeus,2024-03-04 20:01:23,https://www.yahoo.com/news/putin-ally-says-ukraine-definitely-114405941.html?_guc_consent_skip=1709582461,False,False,False,False,0.88,False,Not Available,Not Available,Not Available,Not Available
1b76b81,European crash tester says carmakers must bring back physical controls,2822,279,Traversar,2024-03-05 14:20:13,https://arstechnica.com/cars/2024/03/carmakers-must-bring-back-buttons-to-get-good-safety-scores-in-europe/,False,False,False,False,0.98,False,Not Available,Not Available,Not Available,Not Available
1b6gkh2,"Albania, wary of Russia, reopens Soviet-era air base to NATO",1742,49,giuliomagnifico,2024-03-04 17:22:32,https://www.reuters.com/world/europe/albania-wary-russia-reopens-soviet-era-air-base-nato-2024-03-04/,False,False,False,False,0.98,False,Not Available,Not Available,Not Available,Not Available
1b70dyk,Ghana Anti-LGBTQ Bill Risks $3.8 Billion of World Bank Support,1682,194,bloomberg,2024-03-05 08:28:20,https://www.bloomberg.com/news/articles/2024-03-04/ghana-anti-lgbtq-bill-risks-3-8-billion-of-world-bank-support,False,False,False,False,0.94,False,Not Available,Not Available,Not Available,Not Available
1b6h9d0,"France enshrines 'freedom' to abortion in Constitution, in world first",1638,30,pierrepaul,2024-03-04 17:49:15,https://www.lemonde.fr/en/politics/article/2024/03/04/france-enshrines-freedom-to-abortion-in-constitution-in-world-first_6584252_5.html,False,False,False,False,0.95,False,Not Available,Not Available,Not Available,Not Available
1b74mjf,"Individual error let Moscow intercept military call, Germany says",1690,76,3kOlen,2024-03-05 13:00:07,https://www.theguardian.com/world/2024/mar/05/individual-error-let-moscow-intercept-military-call-germany-says,False,False,False,False,0.97,False,Not Available,Not Available,Not Available,Not Available
1b6oh0y,More than 2 million research papers have disappeared from the Internet,1225,53,Creative_soja,2024-03-04 22:37:33,https://www.nature.com/articles/d41586-024-00616-5,False,False,False,False,0.97,False,Not Available,Not Available,Not Available,Not Available
1b755ul,Russia Eyes Nuclear Plant With China on the Moon in 10 Years,1322,375,bloomberg,2024-03-05 13:26:55,https://www.bloomberg.com/news/articles/2024-03-05/russia-eyes-nuclear-plant-with-china-on-the-moon-in-10-years,False,False,False,False,0.91,False,Not Available,Not Available,Not Available,Not Available
1b6rkmu,EU aims to shift European arms industry to ‘war economy mode’,1121,140,MadShartigan,2024-03-05 00:44:19,https://www.reuters.com/world/europe/eu-aims-shift-european-arms-industry-war-economy-mode-2024-03-04/,False,False,False,False,0.97,False,Not Available,Not Available,Not Available,Not Available
1b6vw4f,"/r/WorldNews Live Thread: Russian Invasion of Ukraine Day 741, Part 1 (Thread #887)",1086,310,WorldNewsMods,2024-03-05 04:02:33,https://www.reddit.com/live/18hnzysb1elcs,False,False,False,True,0.96,False,Not Available,Not Available,Not Available,Not Available
1b74s4i,France's Macron urges allies not be a 'coward' on Ukraine,953,49,UNITED24Media,2024-03-05 13:07:47,https://www.reuters.com/world/europe/frances-macron-urges-allies-not-be-coward-ukraine-2024-03-05/,False,False,False,False,0.94,False,Not Available,Not Available,Not Available,Not Available
1b709xb,Kremlin 'Has Nothing to Say' About Large Crowds at Navalny Gravesite,782,32,4920185,2024-03-05 08:20:14,https://www.themoscowtimes.com/2024/03/04/kremlin-has-nothing-to-say-about-large-crowds-at-navalny-gravesite-a84327,False,False,False,False,0.96,False,Not Available,Not Available,Not Available,Not Available
1b6paiz,Poland buys Saab grenade launchers in $1.63 billion deal,661,86,Toruviel_,2024-03-04 23:09:04,https://www.reuters.com/business/aerospace-defense/poland-buys-saab-grenade-launchers-163-billion-deal-2024-03-04/,False,False,False,False,0.96,False,Not Available,Not Available,Not Available,Not Available
1b6z5hq,"Ukrainian sea drones damage Russian Black Sea fleet patrol ship near Crimea, Ukraine says",528,36,NewSlinger,2024-03-05 07:03:34,https://www.reuters.com/world/europe/ukrainian-sea-drones-damage-russian-black-sea-fleet-patrol-ship-near-crimea-2024-03-05/,False,False,False,False,0.95,False,Not Available,Not Available,Not Available,Not Available
1b70nzs,"Russia using Serbian agent to infiltrate EU bodies, Western intel says",518,28,enkrstic,2024-03-05 08:47:37,https://www.politico.eu/article/russia-use-serbia-agent-spy-infiltrate-eu-institutions-western-intelligence/,False,False,False,False,0.95,False,Not Available,Not Available,Not Available,Not Available
1b72slr,South Korea begins licence suspension process against striking doctors,522,90,GroundbreakingGur930,2024-03-05 11:13:47,https://www.todayonline.com/world/south-korea-begins-licence-suspension-process-against-striking-doctors-2375931,False,False,False,False,0.94,False,Not Available,Not Available,Not Available,Not Available
1b6trdb,Argentina's Telam news agency suspended in President Melei's crackdown on 'propaganda',468,66,SPY225,2024-03-05 02:22:52,https://news4sanantonio.com/news/nation-world/argentinas-telam-news-agency-suspended-in-president-meleis-crackdown-on-propaganda-crackdown-propoganda-president-suspended-telam-argentinas,False,False,False,False,0.94,False,Not Available,Not Available,Not Available,Not Available
1b6r0hv,UK urges Germany to give long-range missiles to Kyiv despite Luftwaffe leak,469,28,riwnodennyk,2024-03-05 00:20:26,https://www.theguardian.com/world/2024/mar/04/uk-urges-germany-to-give-long-range-missiles-to-kyiv-despite-luftwaffe-leak,False,False,False,False,0.95,False,Not Available,Not Available,Not Available,Not Available
1b6qdp4,"Covid-19 increases risk of developing autoimmune disease, but vaccination helps, large study shows",355,41,SPY225,2024-03-04 23:53:31,https://www.statnews.com/2024/03/04/covid-19-south-korea-japan-study-lupus-sjogren-autoimmune-disease/,False,False,False,False,0.88,False,Not Available,Not Available,Not Available,Not Available
1b6h97v,"Terror cell planning ISIS-style attacks caught with 100 explosive devices, Shin Bet says",307,4,inntaxapt,2024-03-04 17:49:06,https://www.ynetnews.com/article/h1pgibxp6,False,False,False,False,0.91,False,Not Available,Not Available,Not Available,Not Available
1b70x13,Archaeologists in Panama find ancient tomb filled with gold treasure — and sacrificial victims,305,11,Elliottafc1,2024-03-05 09:05:49,https://www.cbsnews.com/news/panama-archeology-ancient-tomb-gold-treasure-sacrificial-victims-cocle/,False,False,False,False,0.96,False,Not Available,Not Available,Not Available,Not Available
1b6hbwz,More than 1.3 tons of cocaine seized in the Caribbean Sea as suspects abandon ship,285,55,fromouterspace1,2024-03-04 17:51:57,https://www.cbsnews.com/news/cocaine-seized-caribbean-sea-colombia-suspects-abandon-ship/,False,False,False,False,0.95,False,Not Available,Not Available,Not Available,Not Available
1b6u0z3,Albania sets up first NATO base in Western Balkans,251,8,TheosThe1st,2024-03-05 02:35:23,https://www.euronews.com/2024/03/04/albania-sets-up-first-nato-base-in-western-balkans,False,False,False,False,0.95,False,Not Available,Not Available,Not Available,Not Available
1b6tt6y,"Argentina's government on Monday suspended the Telam state news agency in the wake of an announcement by President Javier Milei that he would shut down what he called a mouthpiece of ""propaganda"" for previous leftist administrations",258,76,DoremusJessup,2024-03-05 02:25:10,https://www.rfi.fr/en/international-news/20240304-argentina-govt-suspends-state-news-agency-telam,False,False,False,False,0.96,False,Not Available,Not Available,Not Available,Not Available
1b6z5uy,Germany not to allow Russian propaganda to shift focus from aid to Ukraine,246,6,Ready_Efficiency_522,2024-03-05 07:04:13,https://www.ukrinform.net/rubric-polytics/3835450-germany-not-to-allow-russian-propaganda-to-shift-focus-from-aid-to-ukraine.html,False,False,False,False,0.92,False,Not Available,Not Available,Not Available,Not Available
1b7179l,"Iran supplying Russia with ballistic missiles shows they are 'bad influence' in Europe, Grant Shapps signals | World News",244,19,Awp_Picco,2024-03-05 09:26:13,https://news.sky.com/story/iran-supplying-russia-with-ballistic-missiles-shows-they-are-bad-influence-in-europe-grant-shapps-signals-13087514,False,False,False,False,0.92,False,Not Available,Not Available,Not Available,Not Available
1b762sf,Twenty thousand NATO troops join Dragon 24 exercises in Poland,252,32,BubsyFanboy,2024-03-05 14:09:29,https://notesfrompoland.com/2024/03/05/twenty-thousand-nato-troops-join-dragon-24-exercises-in-poland/,False,False,False,False,0.95,False,Not Available,Not Available,Not Available,Not Available
1b77yvr,Hungary president signs Sweden's NATO membership ratification,306,17,M795,2024-03-05 15:30:35,https://www.reuters.com/world/europe/hungary-president-signs-swedens-nato-membership-ratification-2024-03-05/,False,False,False,False,0.98,False,Not Available,Not Available,Not Available,Not Available
1b6wluj,Spain's Catalonia hands out free reusable menstruation products,191,14,Forward-Answer-4407,2024-03-05 04:39:46,https://www.reuters.com/world/europe/spains-catalonia-hands-out-free-reusable-menstruation-products-2024-03-04/,False,False,False,False,0.91,False,Not Available,Not Available,Not Available,Not Available
1b6tqhi,German military's leaked call reveals British army's 'direct' involvement in Russia-Ukraine conflict,169,68,2be_0r_not2be,2024-03-05 02:21:41,https://www.firstpost.com/world/german-militarys-leaked-call-reveals-british-armys-direct-involvement-in-russia-ukraine-conflict-13745151.html,False,False,False,False,0.77,False,Not Available,Not Available,Not Available,Not Available
1b713p1,Ukraine's GUR hacked the Russian Ministry of Defense,174,9,Specialist_Mix_22,2024-03-05 09:19:24,https://securityaffairs.com/159981/cyber-warfare-2/ukraine-gur-hacked-russian-ministry-of-defense.html,False,False,False,False,0.93,False,Not Available,Not Available,Not Available,Not Available
1b6u004,China raises defense budget 7.2% as it pushes for global heft and regional tensions continue,151,40,mrwhiskeyrum,2024-03-05 02:34:03,https://apnews.com/article/china-legislature-defense-budget-taiwan-us-9e751a41c9a1ffe8c0cf9775797750e3,False,False,False,False,0.86,False,Not Available,Not Available,Not Available,Not Available
1b6rp92,Greece Open to Military Cooperation with Armenia that Includes France and India,146,3,DavidofSasun,2024-03-05 00:49:50,https://asbarez.com/greece-open-to-military-cooperation-with-armenia-that-includes-france-and-india/,False,False,False,False,0.94,False,Not Available,Not Available,Not Available,Not Available
1b6vkj2,UN rights chief urges end to 'repression' of independent voices in Russia after Navalny's death,147,7,4920185,2024-03-05 03:47:05,https://halifax.citynews.ca/2024/03/04/un-rights-chief-urges-end-to-repression-of-independent-voices-in-russia-after-navalnys-death/,False,False,False,False,0.91,False,Not Available,Not Available,Not Available,Not Available
1b77xio,A Vietnamese property tycoon accused of embezzling $12.5 billion begins her trial,240,20,Human-Entrepreneur77,2024-03-05 15:29:11,https://www.yahoo.com/news/vietnamese-property-tycoon-accused-embezzling-050827818.html,False,False,False,False,0.99,False,Not Available,Not Available,Not Available,Not Available
1b6tytm,Ghana's finance ministry urges president not to sign anti-LGBTQ+ bill,125,2,4920185,2024-03-05 02:32:30,https://www.bbc.com/news/world-africa-68469613,False,False,False,False,0.9,False,Not Available,Not Available,Not Available,Not Available
1b73gqn,"Indian national killed in anti-tank missile attack in Israel, two injured",122,20,austin9794,2024-03-05 11:55:32,https://www.thehindu.com/news/national/one-indian-killed-another-two-injured-in-anti-tank-missile-attack-in-israel/article67915700.ece,False,False,False,False,0.89,False,Not Available,Not Available,Not Available,Not Available
1b6n0ei,Iran Plans To Create DNA Bank Of Journalists,107,14,air_sun_10,2024-03-04 21:39:21,https://www.iranintl.com/en/202403036159,False,False,False,False,0.86,False,Not Available,Not Available,Not Available,Not Available
1b740t0,The UN atomic watchdog's director says he's heading to Moscow for talks on nuclear safety in Ukraine,118,5,truth_in_science,2024-03-05 12:28:04,https://apnews.com/article/ukraine-nuclear-safety-putin-grossi-zaporizhzhia-iaea-d2268853ad90e644ff2ab556c6c7f965,False,False,False,False,0.95,False,Not Available,Not Available,Not Available,Not Available
1b6zes8,"China coastguard's 'dangerous manoeuvres' caused South China Sea collision, Philippines says",105,8,SweetExtent3456,2024-03-05 07:20:43,https://www.reuters.com/world/asia-pacific/china-coast-guard-says-it-takes-measures-against-philippine-vessels-second-2024-03-04/,False,False,False,False,0.89,False,Not Available,Not Available,Not Available,Not Available
1b6gb9t,"Armenia, Greece Vow To Boost Military Ties",91,4,DavidofSasun,2024-03-04 17:12:35,https://www.azatutyun.am/a/32847383.html,False,False,False,False,0.88,False,Not Available,Not Available,Not Available,Not Available
1b714sb,One-fifth of Mekong River fish species face extinction – report,94,1,Gyro_Armadillo,2024-03-05 09:21:32,https://www.gmanetwork.com/news/scitech/science/899457/one-fifth-of-mekong-river-fish-species-face-extinction-report/story/,False,False,False,False,0.93,False,Not Available,Not Available,Not Available,Not Available
1b6lzja,Iran Tried to Persuade Sudan to Allow Naval Base on Its Red Sea Coast,84,5,wsj,2024-03-04 20:58:14,https://www.wsj.com/world/middle-east/iran-tried-to-persuade-sudan-to-allow-naval-base-on-its-red-sea-coast-77ca3922?st=fpzeh6z7h3omqp2,False,False,False,False,0.9,False,Not Available,Not Available,Not Available,Not Available
1b737lq,"Iran has supplied Russia with ballistic missiles, UK defense chief suggests",83,7,senfgurke,2024-03-05 11:39:44,https://www.politico.eu/article/iran-has-supplied-russia-with-ballistic-missiles-uk-defense-chief-suggests/,False,False,False,False,0.89,False,Not Available,Not Available,Not Available,Not Available
1b6smlb,Hard-liners dominate Iran parliamentary vote that saw a record-low turnout and boycott calls,84,6,citytiger,2024-03-05 01:31:33,https://apnews.com/article/iran-parliamentary-election-results-low-turnout-845fabad51eb26bf7fef8087c030f8f8,False,False,False,False,0.88,False,Not Available,Not Available,Not Available,Not Available
1b6tl7r,"China vows to 'transform' economic model, targets growth at around 5%",77,19,panmanculi24,2024-03-05 02:15:08,https://www.reuters.com/world/china/china-targets-2024-gdp-growth-around-5-government-work-report-2024-03-05/,False,False,False,False,0.83,False,Not Available,Not Available,Not Available,Not Available
1b72e6e,At least four Muscovites detained for publicly mourning Alexey Navalny,80,4,duckanroll,2024-03-05 10:47:55,https://novayagazeta.eu/articles/2024/03/05/at-least-four-muscovites-detained-for-publicly-mourning-alexey-navalny-en-news,False,False,False,False,0.89,False,Not Available,Not Available,Not Available,Not Available
1b72z0r,Russia says Western envoys at Navalny funeral meddling in Russia | Reuters,77,21,Human-Entrepreneur77,2024-03-05 11:24:59,https://www.reuters.com/world/russia-says-western-ambassadors-are-meddling-russias-affairs-2024-03-05/,False,False,False,False,0.77,False,Not Available,Not Available,Not Available,Not Available
1b70e5y,Climbers to pay US$13 fee on popular Mount Fuji trail,74,16,Gyro_Armadillo,2024-03-05 08:28:47,https://www.channelnewsasia.com/asia/japan-mount-fuji-fee-climbers-july-2024-mountain-4172171,False,False,False,False,0.9,False,Not Available,Not Available,Not Available,Not Available
1b6gd59,Saab starts construction of new Carl-Gustaf factory in India,68,1,King112TA,2024-03-04 17:14:42,https://www.saab.com/newsroom/press-releases/2024/saab-starts-construction-of-new-carl-gustaf-factory-in-india,False,False,False,False,0.85,False,Not Available,Not Available,Not Available,Not Available
1b75vaq,ICC issues arrest warrants for two Russian military commanders for alleged war crimes in Ukraine,76,2,duckanroll,2024-03-05 14:00:30,https://novayagazeta.eu/articles/2024/03/05/icc-issues-arrest-warrants-for-two-russian-military-commanders-for-alleged-war-crimes-in-ukraine-en-news,False,False,False,False,0.93,False,Not Available,Not Available,Not Available,Not Available
1b6yte2,North Korea threatens to take military moves in response to US-South Korean drills,67,32,urmomsloosevag,2024-03-05 06:42:37,https://apnews.com/article/north-korea-south-korea-us-military-drills-c34f927220ccac9c677ffcba5d5f820d,False,False,False,False,0.81,False,Not Available,Not Available,Not Available,Not Available
1b72yja,Gaza ceasefire talks end with no breakthrough as Ramadan deadline looms,70,12,itailitai,2024-03-05 11:24:08,https://www.reuters.com/world/middle-east/gaza-ceasefire-talks-end-with-no-breakthrough-ramadan-deadline-looms-2024-03-05/,False,False,False,False,0.82,False,Not Available,Not Available,Not Available,Not Available
1b6ugle,China’s Property Debt Woes Deepen as Vanke Under Closer Scrutiny,65,1,4920185,2024-03-05 02:55:15,https://www.bloomberg.com/news/articles/2024-03-04/china-s-top-insurers-warn-of-vanke-risks-amid-debt-delay-talks,False,False,False,False,0.82,False,Not Available,Not Available,Not Available,Not Available
1b718pq,South China Sea: Philippines accuses China coastguard of ‘reckless’ action after collision | South China Sea,58,3,Soopah_Fly,2024-03-05 09:29:19,https://www.theguardian.com/world/2024/mar/05/south-china-sea-philippines-accuses-china-coastguard-of-reckless-action-after-collision,False,False,False,False,0.83,False,Not Available,Not Available,Not Available,Not Available
1b6j8tl,Polish government unveils planned overhaul of “defective” constitutional court,58,4,BubsyFanboy,2024-03-04 19:08:07,https://notesfrompoland.com/2024/03/04/polish-government-unveils-planned-overhaul-of-defective-constitutional-court/,False,False,False,False,0.81,False,Not Available,Not Available,Not Available,Not Available
1b6yr6d,4 Filipinos hurt after China uses water cannons vs Ayungin resupply vessel,59,8,CumilkButbetter,2024-03-05 06:38:56,https://www.rappler.com/philippines/collision-china-ayungin-shoal-causes-damage-coast-guard-ship/,False,False,False,False,0.79,False,Not Available,Not Available,Not Available,Not Available
1b6j0b4,US Sanctions Zimbabwe President Mnangagwa Over Human Rights,55,2,HenzShuyi,2024-03-04 18:58:42,https://www.bloomberg.com/news/articles/2024-03-04/us-sanctions-zimbabwe-president-mnangagwa-over-human-rights-ltd5sfv4,False,False,False,False,0.84,False,Not Available,Not Available,Not Available,Not Available
1b6h9i8,South Korea and US begin large annual military drills with eye on North Korea | CNN,53,3,Gyro_Armadillo,2024-03-04 17:49:27,https://edition.cnn.com/2024/03/04/asia/us-south-korea-military-exercises-intl-hnk-ml/index.html,False,False,False,False,0.82,False,Not Available,Not Available,Not Available,Not Available
1b6h40f,NASA’s SpaceX Crew-8 Launches to International Space Station - NASA,52,8,Ecstatic_Ad_4476,2024-03-04 17:43:25,https://www.nasa.gov/news-release/nasas-spacex-crew-8-launches-to-international-space-station/,False,False,False,False,0.81,False,Not Available,Not Available,Not Available,Not Available
1b70i6t,China drops 'peaceful reunification' reference to Taiwan,43,6,UGMadness,2024-03-05 08:36:18,https://www.reuters.com/world/china/china-drops-peaceful-reunification-reference-taiwan-raises-defence-spending-by-2024-03-05/,False,False,False,False,0.74,False,Not Available,Not Available,Not Available,Not Available
1b70gnd,"Philippines says boats damaged, crew injured in incident with Chinese vessels",44,1,Gyro_Armadillo,2024-03-05 08:33:20,https://www.philstar.com/headlines/2024/03/05/2338255/philippine-boat-damaged-collision-china-coast-guard-pcg,False,False,False,False,0.82,False,Not Available,Not Available,Not Available,Not Available
1b6j6q4,Hard-liners dominate Iran parliamentary vote that saw a record-low turnout and boycott calls,46,3,DoremusJessup,2024-03-04 19:05:40,https://english.elpais.com/international/2024-03-04/hard-liners-dominate-iran-parliamentary-vote-that-saw-a-record-low-turnout-and-boycott-calls.html,False,False,False,False,0.84,False,Not Available,Not Available,Not Available,Not Available
1b6t61a,Australia promises $2 billion fund for South-East Asian countries,42,15,Gyro_Armadillo,2024-03-05 01:55:52,https://www.abc.net.au/news/2024-03-05/australia-promises-2-billion-fund-for-south-east-asian-countries/103544150,False,False,False,False,0.82,False,Not Available,Not Available,Not Available,Not Available
1b79amx,Parents of Supernova festival victims sue AP and Reuters for NIS 25 million in damages,81,19,ThisIsNotCorn,2024-03-05 16:21:43,https://www.timesofisrael.com/parents-of-supernova-festival-victims-sue-ap-and-reuters-for-nis-25-million-in-damages/,False,False,False,False,0.79,False,Not Available,Not Available,Not Available,Not Available
1b6i8j5,Libya's coast guard tried to prevent rescue of migrants in the Mediterranean,42,3,giuliomagnifico,2024-03-04 18:27:46,https://www.africanews.com/2024/03/04/libyas-coast-guard-tried-to-prevent-rescue-of-migrants-in-the-mediterranean/,False,False,False,False,0.77,False,Not Available,Not Available,Not Available,Not Available
1b72g5t,Ukraine presses EU to allow extradition of war criminals,37,0,3kOlen,2024-03-05 10:51:36,https://www.theguardian.com/world/2024/mar/05/ukraine-presses-eu-to-allow-extradition-of-war-criminals-wagner-group,False,False,False,False,0.83,False,Not Available,Not Available,Not Available,Not Available
1b777uo,Philippine and Chinese vessels collide in disputed South China Sea and 4 Filipino crew are injured,30,0,lurker_bee,2024-03-05 14:59:41,https://apnews.com/article/philippines-china-south-china-sea-collision-e69d9506e85d1d23685db4f220b50d71,False,False,False,False,0.82,False,Not Available,Not Available,Not Available,Not Available
1b6hn2p,Germany: Lufthansa braces for new ground crew strike – DW – 03/04/2024,29,0,Gyro_Armadillo,2024-03-04 18:04:10,https://www.dw.com/en/germany-union-calls-another-lufthansa-ground-staff-strike/a-68431415,False,False,False,False,0.83,False,Not Available,Not Available,Not Available,Not Available
